<?xml version="1.0" encoding="utf-8"?>

<project xmlns="ClassGenerator4"
     xmlns:xsi="http://www.w3.org/2001/XMLSchema-instance"
	   xsi:schemaLocation="ClassGenerator4 https://raw.githubusercontent.com/christoforosl/codegen-lib/master/org.codegen.libs/org.codegen.lib/classGenerator.4.xsd" >

  <generatorVersion>4</generatorVersion>
  <projectFile>.\ModelLibVBGeneratedCode.vbproj</projectFile>
  <projectName>ModelLibTests</projectName>
  <outputDir>.</outputDir>
  <dotNetLanguage>VB</dotNetLanguage>
  <testProjectOutputDir>.\Tests</testProjectOutputDir>
  <defaultNamespace>VbBusObjects</defaultNamespace>
  <defaultDBMapperNameSpace>VbBusObjects.DBMappers</defaultDBMapperNameSpace>
  <propertiesPrefix>Pr</propertiesPrefix>
  <dbConnectionString>
    Integrated Security=SSPI;Persist Security Info=False;Initial Catalog=modelTest;Data Source=.\SQLEXPRESS2014
  </dbConnectionString>
  <dbConnectionDialect>MSSQL</dbConnectionDialect>
  <dbConnectionType>CONN_MSSQL</dbConnectionType>
  <!--<UIProjectOutputDir>..\ModelLibTestsWinApp\</UIProjectOutputDir>-->

  <booleanFields>
    <booleanField tableName="Project" fieldName="isActive" />
  </booleanFields>
  <enumerationFields>

    <enumarationField tableName="Project" fieldName="ProjectTypeId" enumType="EnumProjectType" />

  </enumerationFields>


  <table>

    <TableName>Employee</TableName>
    <SortField>EmployeeName</SortField>
    <SortAscending>true</SortAscending>
    <GenerateUI>1</GenerateUI>
    <SelectObject>vEmployee</SelectObject>
    <Lookups>
      <FieldName>EmployeeRankId</FieldName>
      <DataSource>VbBusObjects.EmployeeRank</DataSource>
      <ValueMember>RankId</ValueMember>
      <DisplayMember>Rank</DisplayMember>
    </Lookups>

    <association>
      <relationType>PARENT</relationType>
      <DataType>VbBusObjects.EmployeeRank</DataType>
      <AssociationName>Rank</AssociationName>
      <cardinality>1</cardinality>

      <parentFieldName>RankId</parentFieldName>
      <childFieldName>EmployeeRankId</childFieldName>

    </association>
    <association>
      <relationType>CHILD</relationType>
      <DataType>VbBusObjects.EmployeeInfo</DataType>
      <AssociationName>EmployeeInfo</AssociationName>
      <cardinality>1</cardinality>
      <parentFieldName>EmployeeId</parentFieldName>
      <childFieldName>EIEmployeeId</childFieldName>

    </association>

    <association>
      <relationType>CHILD</relationType>
      <DataType>VbBusObjects.EmployeeProject</DataType>
      <AssociationName>EmployeeProjects</AssociationName>
      <AssociationSingular>EmployeeProject</AssociationSingular>
      <cardinality>*</cardinality>
      <parentFieldName>EmployeeId</parentFieldName>
      <childFieldName>EPEmployeeId</childFieldName>
    </association>

  </table>

  <table>
    <TableName>EmployeeProject</TableName>
    <ClassName>EmployeeProject</ClassName>
    <GenerateUI>1</GenerateUI>

    <association>
      <relationType>PARENT</relationType>
      <DataType>VbBusObjects.Project</DataType>
      <AssociationName>Project</AssociationName>
      <AssociationSingular>Project</AssociationSingular>
      <cardinality>1</cardinality>

      <parentFieldName>ProjectId</parentFieldName>
      <childFieldName>EPProjectId</childFieldName>

    </association>

  </table>

  <table>
    <TableName>EmployeeRank</TableName>
    <ClassName>EmployeeRank</ClassName>
    <GenerateUI>1</GenerateUI>
  </table>

  <table>
    <TableName>EmployeeInfo</TableName>
    <GenerateUI>1</GenerateUI>
  </table>

  <table>
    <TableName>Project</TableName>
    <ClassName>Project</ClassName>
    <GenerateUI>1</GenerateUI>

    <association>
      <relationType>CHILD</relationType>
      <DataType>VbBusObjects.EmployeeProject</DataType>
      <AssociationName>EmployeeProjects</AssociationName>
      <AssociationSingular>EmployeeProject</AssociationSingular>
      <cardinality>*</cardinality>

      <parentFieldName>ProjectId</parentFieldName>
      <childFieldName>EPProjectId</childFieldName>

    </association>

  </table>
  
  <table>
    <TableName>EmployeeType</TableName>
  </table>

  <table>
    <!-- testing of undescores in name -->
    <TableName>Employee_Evaluation</TableName>
  </table>


  <table>
    <TableName>Account</TableName>
    <ClassName>Account</ClassName>
    <GenerateUI>0</GenerateUI>
    
    <association>
      <relationType>CHILD</relationType>
      <DataType>VbBusObjects.AccountBankInfo</DataType>
      <AssociationName>BankAccountInfo</AssociationName>
      <cardinality>1</cardinality>
      <parentFieldName>accountid</parentFieldName>
      <childFieldName>accountid</childFieldName>
    </association>


  </table>

  <table>
    <TableName>Bank</TableName>
    <ClassName>Bank</ClassName>
    
  </table>

  <table>
    <TableName>AccountInfo</TableName>
    <ClassName>AccountBankInfo</ClassName>
    
    <association>
      <relationType>PARENT</relationType>
      <DataType>VbBusObjects.Bank</DataType>
      <AssociationName>Bank</AssociationName>
      <cardinality>1</cardinality>
      <parentFieldName>bankid</parentFieldName>
      <childFieldName>bankId</childFieldName>
    </association>
  </table>

</project>
