<?xml version="1.0" encoding="utf-8"?>
<project xmlns="ClassGenerator4"
     xmlns:xsi="http://www.w3.org/2001/XMLSchema-instance"
	   xsi:schemaLocation="ClassGenerator4 https://raw.githubusercontent.com/christoforosl/codegen-lib/master/org.codegen.libs/org.codegen.lib/classGenerator.4.xsd" >


  <generatorVersion>4</generatorVersion>
  <projectFile>.\ModelLibCSharpOracleGenCode.csproj</projectFile>
  <projectName>ModelLibCSharpTests</projectName>
  <outputDir>.\</outputDir>
  <dotNetLanguage>CSHARP</dotNetLanguage>

  <testProjectOutputDir>.\OracleTests</testProjectOutputDir>

  <defaultNamespace>OracleModel</defaultNamespace>
  <defaultDBMapperNameSpace>OracleMappers</defaultDBMapperNameSpace>

  <propertiesPrefix>Pr</propertiesPrefix>
  <dbConnectionString>
    Data Source=(DESCRIPTION = (ADDRESS = (PROTOCOL = TCP)(HOST = polnewdbsrv0)(PORT = 1521))(CONNECT_DATA = (SERVER = DEDICATED)(SID = CPCS)));User Id = hrnuf;Password=hr
  </dbConnectionString>
  <dbConnectionDialect>ORACLE</dbConnectionDialect>
  <dbConnectionType>CONN_ORACLE</dbConnectionType>
  
  <table>
    <TableName>EMPLOYEE_TRAINING_HISTORY</TableName>
    <association>
      <relationType>PARENT</relationType>
      <DataType>OracleModel.TrainingCourse</DataType>
      <AssociationName>TrainingCourse</AssociationName>
      <cardinality>1</cardinality>
      <parentFieldName>CODE</parentFieldName>
      <childFieldName>training_course_code</childFieldName>
    </association>

  </table>

  <table>
    <TableName>DEPARTMENTS</TableName>
    <ClassName>Department</ClassName>
  </table>
  <table>
    <TableName>COUNTRIES</TableName>
    <ClassName>Country</ClassName>
  </table>

  <!--
  <table>
    <TableName>XML_TYPE_TEST</TableName>
    <ClassName>XmlTypeTest</ClassName>
  </table>
-->

  <table>
    <TableName>EMPLOYEES</TableName>
    <ClassName>Employee</ClassName>
    <SelectObject>EMP_DETAILS_VIEW</SelectObject>

    <association>
      <relationType>CHILD</relationType>
      <DataType>OracleModel.JobHistory</DataType>

      <AssociationName>JobHistory</AssociationName>
      <cardinality>*</cardinality>

      <parentFieldName>employee_id</parentFieldName>
      <childFieldName>employee_id</childFieldName>

    </association>

    <association>
      <relationType>PARENT</relationType>
      <DataType>OracleModel.Department</DataType>
      <AssociationName>Department</AssociationName>
      <cardinality>1</cardinality>
      <parentFieldName>Department_id</parentFieldName>
      <childFieldName>Department_id</childFieldName>
    </association>

    <association>
      <relationType>CHILD</relationType>
      <DataType>OracleModel.EmployeeTrainingHistory</DataType>
      <AssociationName>Courses</AssociationName>
      <cardinality>*</cardinality>
      <parentFieldName>employee_id</parentFieldName>
      <childFieldName>employee_id</childFieldName>


    </association>

    <association>
      <relationType>CHILD</relationType>
      <DataType>OracleModel.EmployeeTrainingHistory</DataType>
      <AssociationName>TrainingHistory</AssociationName>
      <cardinality>*</cardinality>
      <parentFieldName>employee_id</parentFieldName>
      <childFieldName>employee_id</childFieldName>



    </association>

  </table>
  <table>
    <TableName>JOBS</TableName>
    <ClassName>Job</ClassName>

  </table>
  <table>
    <TableName>JOB_HISTORY</TableName>
    <ClassName>JobHistory</ClassName>
  </table>
  <table>
    <TableName>LOCATIONS</TableName>
    <ClassName>Location</ClassName>

  </table>
  <table>
    <TableName>REGIONS</TableName>
    <ClassName>Region</ClassName>
  </table>



  <table>
    <TableName>training_courses</TableName>
    <ClassName>TrainingCourse</ClassName>
  </table>

</project>
